{
  "snapshot_id": "chat01-canon-v4",
  "schema_version": 1,
  "created_at": "2026-08-07T17:41:13+08:00",
  "hash_algorithm": "sha256",
  "sources": [
    {
      "authority_rank": 1,
      "path": "需求文档/项目框架需求.md",
      "bytes": 18591,
      "sha256": "d1a49ceb41f6d1e75c8515bffa89b0db662f81c3d7f3193b48d11d6c75a36757",
      "role": "product_requirements"
    },
    {
      "authority_rank": 2,
      "path": "人物设定/秦/角色设定定稿.md",
      "bytes": 26406,
      "sha256": "2a2107ffb1c5e37fcc80e591704a7de43d21f13030a86b18135c454e7a5ba3f5",
      "role": "character_prose"
    },
    {
      "authority_rank": 3,
      "path": "人物设定/秦/bible.yaml",
      "bytes": 12689,
      "sha256": "e07f7226aa6ad9b122bd6f7e8d0cbca79aef91d2b4956863a4c4510a968b8b3b",
      "role": "character_bible"
    },
    {
      "authority_rank": 4,
      "path": "人物设定/秦/canon.json",
      "bytes": 5847,
      "sha256": "f8dcdc3e75c6433ef095800c76d9dd1bc7f2221da1d5ab8645701eabd0998530",
      "role": "character_facts"
    },
    {
      "authority_rank": 5,
      "path": "人物设定/秦/timeline.yaml",
      "bytes": 11283,
      "sha256": "c9de786b19de5bf08e9a9aca153a2db30394e5b2e66d79ca0cbf556a819bf2b5",
      "role": "character_timeline"
    },
    {
      "authority_rank": 6,
      "path": "设计文档/AI女友最小心智系统设计.md",
      "bytes": 29327,
      "sha256": "a7f7c7da0b283708154b37410465885367792a55a16a9923c654f8cd58bc5697",
      "role": "ai_implementation"
    }
  ],
  "resolved_facts": {
    "character_name": "秦未晞",
    "character_age": 22,
    "player_name": "浩然",
    "player_age": 24,
    "occupation": "自由插画师 / 自媒体博主",
    "city": "金陵",
    "current_living": "两居室合租，刚开始不到一个月",
    "current_relationship": "合租室友 + 暧昧期，尚未确认恋爱或婚姻",
    "character_to_player_names": [
      "B哥",
      "浩然"
    ],
    "player_to_character_name": "秦老"
  },
  "consistency": {
    "status": "consistent",
    "conflicts": [],
    "notes": "v5 接受当前产品路线更新：P0 主模型改为 Qwen3.5-4B；约 1000 条仅是首个工程候选；自我时间线、离线经历、内生欲望和主动联系成为 P0 能力。角色硬事实与 v4 一致。"
  }
}
